{
  "asset_generation": "4627c130098156d10a63fc3268e359597e7e6d8a615acac1dc430422f14677fc",
  "asset_id": "builtin:layout:p25-spec-table",
  "dependency_hashes": {
    "canonical/layouts/p25-spec-table/layout.json": "0adb49302a99a8a90484fc7853ef7c9e724d82730c79390cdf346ca188e7fe43",
    "canonical/layouts/p25-spec-table/notes.md": "9a3fc8ee62ed23d98d9b643ccc95d77ac64abd5e75d2176c795c48fdd6f193a2",
    "canonical/templates/spec-table/page.html": "a3605bda65935b2854b987e2369d57a36f014d5b01756120df053da0dc0104c7",
    "canonical/templates/spec-table/template.json": "eec309ab46687888bc803b008fdfa103c1feaf6d6ad4efc4358ade853052bef3"
  },
  "environment": {
    "path": "evidence/probes/expression-first-2026-09-20/environment.json",
    "sha256": "c086a6941db721115351b6a2b0c5d7c5e474ce1a96e59ecb10eebc75309236db"
  },
  "evidence_digest": "e22092d23e8da9be807c53edb32153532076742c863e63c6171628de09b88022",
  "kind": "capability-evidence",
  "lane": "render:html",
  "oracle": {
    "owner": "004-U12-product-contract",
    "path": "evidence/oracles/relation-output-v1.json",
    "sha256": "6532c718cc05f95695de599e43070f36c387974019a9b8875ea9e2df0ae90c1a",
    "version": "relation-output-v1"
  },
  "probes": {
    "negative": {
      "artifact": {
        "path": "evidence/probes/expression-first-2026-09-20/comparison/negative.png",
        "sha256": "1d494407d549cad0a80d3f025ef8402f11a10f7aec61c43030e4325597c13282"
      },
      "fixture": {
        "path": "evidence/probes/expression-first-2026-09-20/comparison/negative-fixture.json",
        "sha256": "375b7f5b64cc522a6d083ebc54b7113d8ec3ba4b6d6fdfe8110ad8e3b8e65272"
      },
      "observation": {
        "path": "evidence/probes/expression-first-2026-09-20/comparison/negative-observation.json",
        "sha256": "b650ad191399544b93a046c60c73126d80063524f22b71b52218aae4aba6755e"
      },
      "status": "passed"
    },
    "positive": {
      "artifact": {
        "path": "evidence/probes/expression-first-2026-09-20/comparison/positive.png",
        "sha256": "0e64bd232811198202652e78d99e29b49e5fdad4137d0d308125fa98ae4f5755"
      },
      "fixture": {
        "path": "evidence/probes/expression-first-2026-09-20/comparison/positive-fixture.json",
        "sha256": "b72f484dc5869c3dd856c8d5641c892d8b851336de3fbb081a9e9bc123cf97ef"
      },
      "observation": {
        "path": "evidence/probes/expression-first-2026-09-20/comparison/positive-observation.json",
        "sha256": "c4ec16b8e8754690eb3dc0aee44adbbe1e724f0d9050268e72901559aafdc2d4"
      },
      "status": "passed"
    }
  },
  "receipt_id": "0269252d2f41d5d2f4fa566496ebb7cff170799055d4b28240ac2e7032cf1e62/comparison",
  "relation": "comparison",
  "schema_version": 1,
  "visual_review": null
}
