{
  "asset_generation": "f4685bba4757b341cc6d46c067f6f8f758c8a054ce84a51b406d7c2f3e95893f",
  "asset_id": "builtin:layout:body-basic",
  "dependency_hashes": {
    "canonical/layouts/body-basic/layout.json": "49e56bb0ab443a9ba629245978c33814f02dd9ee9c448dc62ab81f9b43b32d7d",
    "canonical/layouts/body-basic/notes.md": "ba948b2ec6ecf241a41675c9b32063fb0e7ec42098a795fc4017cfb883e32e09",
    "canonical/templates/body-basic/page.html": "c4f44eaa064da328cc187d59aca932cb16e576cce65d533ab97ab0ed32acac17",
    "canonical/templates/body-basic/template.json": "3feda979c71fcb66d7c99f5d92845e8bd59f591c38e242a10025355ebbff29e7"
  },
  "environment": {
    "path": "evidence/probes/opt-code-20260920-rel5/environment.json",
    "sha256": "71e3b998dc120c27b13a8e929ada11dce92a7782881a24d76d8d1e5bf60f7d43"
  },
  "evidence_digest": "9d187d10a4784fce16d4998f58b057af4a4acc88e2aa401ba7ad349757df9a31",
  "kind": "capability-evidence",
  "lane": "render:html",
  "oracle": {
    "owner": "004-U12-product-contract",
    "path": "evidence/oracles/relation-output-v1.json",
    "sha256": "6532c718cc05f95695de599e43070f36c387974019a9b8875ea9e2df0ae90c1a",
    "version": "relation-output-v1"
  },
  "probes": {
    "negative": {
      "artifact": {
        "path": "evidence/probes/opt-code-20260920-rel5/process/negative.png",
        "sha256": "faf93d9f0c38139e461403b941482422c4238d8fd1bb298dfc8013221bb541ad"
      },
      "fixture": {
        "path": "evidence/probes/opt-code-20260920-rel5/process/negative-fixture.json",
        "sha256": "0d6cf2d7bbcd586bd575a1c4f734d93c2e974a97cd0b2d01d4d1c3decef110b5"
      },
      "observation": {
        "path": "evidence/probes/opt-code-20260920-rel5/process/negative-observation.json",
        "sha256": "dc4c49bb0367bb6326bac3b859f7d17c984339643dd6cdaae4151854bb120310"
      },
      "status": "passed"
    },
    "positive": {
      "artifact": {
        "path": "evidence/probes/opt-code-20260920-rel5/process/positive.png",
        "sha256": "0ef724a7f446eaadacfd73f428fe7f87b244716461a5dc686dcc9a3e40d89e60"
      },
      "fixture": {
        "path": "evidence/probes/opt-code-20260920-rel5/process/positive-fixture.json",
        "sha256": "d5f1ef71679e1f9cc6dc3bf37470c9718584b83953d6a0c50f385a6abd1a2e20"
      },
      "observation": {
        "path": "evidence/probes/opt-code-20260920-rel5/process/positive-observation.json",
        "sha256": "3bb2c579ebe748865a850a0d6005b3eb772d3c3afb781728ee7a7a982d112d5b"
      },
      "status": "passed"
    }
  },
  "receipt_id": "dac2cc21f3225b76cdd69abf1747bfbad29339de6ffe2f1c932ef8ff5a96d52b/process",
  "relation": "process",
  "schema_version": 1,
  "visual_review": null
}
