{
  "asset_generation": "2481c81f96d17d2740bf7f62fadce57098f2b79bded852f3677a556d525cfa9d",
  "asset_id": "builtin:layout:body-basic",
  "dependency_hashes": {
    "canonical/layouts/body-basic/layout.json": "49e56bb0ab443a9ba629245978c33814f02dd9ee9c448dc62ab81f9b43b32d7d",
    "canonical/layouts/body-basic/notes.md": "ba948b2ec6ecf241a41675c9b32063fb0e7ec42098a795fc4017cfb883e32e09",
    "canonical/templates/body-basic/page.html": "c4f44eaa064da328cc187d59aca932cb16e576cce65d533ab97ab0ed32acac17",
    "canonical/templates/body-basic/template.json": "3feda979c71fcb66d7c99f5d92845e8bd59f591c38e242a10025355ebbff29e7"
  },
  "environment": {
    "path": "evidence/probes/expression-first-output-v6-current/environment.json",
    "sha256": "a2969d5e76143476d3380e0d7a8ba8f844cde19b472c0aa6a19f035a713967fd"
  },
  "evidence_digest": "5b17071a399db7bdc8ec527dbf2cda4e266bb139e708bf0adfd99d97f2e229fc",
  "kind": "capability-evidence",
  "lane": "render:html",
  "oracle": {
    "owner": "004-U12-product-contract",
    "path": "evidence/oracles/relation-output-v1.json",
    "sha256": "6532c718cc05f95695de599e43070f36c387974019a9b8875ea9e2df0ae90c1a",
    "version": "relation-output-v1"
  },
  "probes": {
    "negative": {
      "artifact": {
        "path": "evidence/probes/expression-first-output-v6-current/causal/negative.png",
        "sha256": "04858c794e908dd4e2d8e80458a0db14200d841649b28cd90a91eea710827f14"
      },
      "fixture": {
        "path": "evidence/probes/expression-first-output-v6-current/causal/negative-fixture.json",
        "sha256": "6129338aeed50cea23126761a8a1fe5a454d951c376508224e9dc8211a8a556a"
      },
      "observation": {
        "path": "evidence/probes/expression-first-output-v6-current/causal/negative-observation.json",
        "sha256": "d6d2c557aca7143117c6d88b6b9399c6ba4537b5e3dc3606b651bc50d5caa186"
      },
      "status": "passed"
    },
    "positive": {
      "artifact": {
        "path": "evidence/probes/expression-first-output-v6-current/causal/positive.png",
        "sha256": "ed400552535eb7789a15f2e1a51180a413b312581d182452fadb39a567637de5"
      },
      "fixture": {
        "path": "evidence/probes/expression-first-output-v6-current/causal/positive-fixture.json",
        "sha256": "b60a10ec82163e3b05a183b96b49d939269b7295d8200d7df3b97bc2271920b1"
      },
      "observation": {
        "path": "evidence/probes/expression-first-output-v6-current/causal/positive-observation.json",
        "sha256": "cb3e365eb02baf4dd60cc2731b6d68b503d758ce225140fbfbde355a9dfec198"
      },
      "status": "passed"
    }
  },
  "receipt_id": "935a45417a5ccb0ee86625957b0e2d33f181e2464983f4a6f75e8a95b4a88dea/causal",
  "relation": "causal",
  "schema_version": 1,
  "visual_review": null
}
