{
  "asset_generation": "4627c130098156d10a63fc3268e359597e7e6d8a615acac1dc430422f14677fc",
  "asset_id": "builtin:layout:p25-spec-table",
  "dependency_hashes": {
    "canonical/layouts/p25-spec-table/layout.json": "0adb49302a99a8a90484fc7853ef7c9e724d82730c79390cdf346ca188e7fe43",
    "canonical/layouts/p25-spec-table/notes.md": "9a3fc8ee62ed23d98d9b643ccc95d77ac64abd5e75d2176c795c48fdd6f193a2",
    "canonical/templates/spec-table/page.html": "a3605bda65935b2854b987e2369d57a36f014d5b01756120df053da0dc0104c7",
    "canonical/templates/spec-table/template.json": "eec309ab46687888bc803b008fdfa103c1feaf6d6ad4efc4358ade853052bef3"
  },
  "environment": {
    "path": "evidence/probes/expression-first-provider-pin-2026-09-20/environment.json",
    "sha256": "a34ecec711c1fa5155cff0a3e6b5e23c3ab941457597da7ce2efeee0b4e973d6"
  },
  "evidence_digest": "24570940ef4c98393d9968c83d6ae38ca74b48413fe5fafede52fad1b25ea9cb",
  "kind": "capability-evidence",
  "lane": "render:html",
  "oracle": {
    "owner": "004-U12-product-contract",
    "path": "evidence/oracles/relation-output-v1.json",
    "sha256": "6532c718cc05f95695de599e43070f36c387974019a9b8875ea9e2df0ae90c1a",
    "version": "relation-output-v1"
  },
  "probes": {
    "negative": {
      "artifact": {
        "path": "evidence/probes/expression-first-provider-pin-2026-09-20/trend/negative.png",
        "sha256": "fcccfe3a95b72c7b8c39cb53092a30b11b132328f5429acdce07d5886e5af4a5"
      },
      "fixture": {
        "path": "evidence/probes/expression-first-provider-pin-2026-09-20/trend/negative-fixture.json",
        "sha256": "cd118bd7e5a19f220e3775d5433bc5781f81a24e9db39bd7919834a4f55c5695"
      },
      "observation": {
        "path": "evidence/probes/expression-first-provider-pin-2026-09-20/trend/negative-observation.json",
        "sha256": "1f606001c4ae74678348c11a155d1d1e0b707dce28af92cfaed5930fcfe573bc"
      },
      "status": "passed"
    },
    "positive": {
      "artifact": {
        "path": "evidence/probes/expression-first-provider-pin-2026-09-20/trend/positive.png",
        "sha256": "cdf67bab536d6858d8bef58e5eb26b65f7411c32f50dd4e136e57ccf755600f1"
      },
      "fixture": {
        "path": "evidence/probes/expression-first-provider-pin-2026-09-20/trend/positive-fixture.json",
        "sha256": "c4b949bdb873f93dfe28026e559ce5eb762212a31e1d40e365ae2d38c9dda7ad"
      },
      "observation": {
        "path": "evidence/probes/expression-first-provider-pin-2026-09-20/trend/positive-observation.json",
        "sha256": "006f835c9092edb60ed200f78fa7032eeeabab7e84960c932917821bd0ebba08"
      },
      "status": "passed"
    }
  },
  "receipt_id": "f8d53ac7a5268f2b790e75ae8fdbdadc45797ca89ed0ba2b6f38d164ab8c96c2/trend",
  "relation": "trend",
  "schema_version": 1,
  "visual_review": null
}
