{
  "asset_generation": "f4685bba4757b341cc6d46c067f6f8f758c8a054ce84a51b406d7c2f3e95893f",
  "asset_id": "builtin:layout:p25-spec-table",
  "dependency_hashes": {
    "canonical/layouts/p25-spec-table/layout.json": "0adb49302a99a8a90484fc7853ef7c9e724d82730c79390cdf346ca188e7fe43",
    "canonical/layouts/p25-spec-table/notes.md": "9a3fc8ee62ed23d98d9b643ccc95d77ac64abd5e75d2176c795c48fdd6f193a2",
    "canonical/templates/spec-table/page.html": "a3605bda65935b2854b987e2369d57a36f014d5b01756120df053da0dc0104c7",
    "canonical/templates/spec-table/template.json": "eec309ab46687888bc803b008fdfa103c1feaf6d6ad4efc4358ade853052bef3"
  },
  "environment": {
    "path": "evidence/probes/expression-first-final-source-2026-09-20/environment.json",
    "sha256": "13834d99b71d6a84aceb0ce6247ee22df05ffb4862dd0920029556d0ff6b9d5c"
  },
  "evidence_digest": "442299c89268741b94020fa1a83fe2236eb2cc2ad6a9a149d90bdc17b44cc96d",
  "kind": "capability-evidence",
  "lane": "render:html",
  "oracle": {
    "owner": "004-U12-product-contract",
    "path": "evidence/oracles/relation-output-v1.json",
    "sha256": "6532c718cc05f95695de599e43070f36c387974019a9b8875ea9e2df0ae90c1a",
    "version": "relation-output-v1"
  },
  "probes": {
    "negative": {
      "artifact": {
        "path": "evidence/probes/expression-first-final-source-2026-09-20/comparison/negative.png",
        "sha256": "1d494407d549cad0a80d3f025ef8402f11a10f7aec61c43030e4325597c13282"
      },
      "fixture": {
        "path": "evidence/probes/expression-first-final-source-2026-09-20/comparison/negative-fixture.json",
        "sha256": "375b7f5b64cc522a6d083ebc54b7113d8ec3ba4b6d6fdfe8110ad8e3b8e65272"
      },
      "observation": {
        "path": "evidence/probes/expression-first-final-source-2026-09-20/comparison/negative-observation.json",
        "sha256": "d50ba99104b70adb1a0bb71e077c973699c449b99de16cfc9eef02da2e76f1a3"
      },
      "status": "passed"
    },
    "positive": {
      "artifact": {
        "path": "evidence/probes/expression-first-final-source-2026-09-20/comparison/positive.png",
        "sha256": "0e64bd232811198202652e78d99e29b49e5fdad4137d0d308125fa98ae4f5755"
      },
      "fixture": {
        "path": "evidence/probes/expression-first-final-source-2026-09-20/comparison/positive-fixture.json",
        "sha256": "b72f484dc5869c3dd856c8d5641c892d8b851336de3fbb081a9e9bc123cf97ef"
      },
      "observation": {
        "path": "evidence/probes/expression-first-final-source-2026-09-20/comparison/positive-observation.json",
        "sha256": "abe25def8bbdcc824c2eeed0a547dcaddf020e6b68883cef322b4a2744152068"
      },
      "status": "passed"
    }
  },
  "receipt_id": "50175018e18a8a435fad5866ac181f4ba0c39c632940e92ded73b5c3349d99f0/comparison",
  "relation": "comparison",
  "schema_version": 1,
  "visual_review": null
}
