{
  "asset_generation": "2481c81f96d17d2740bf7f62fadce57098f2b79bded852f3677a556d525cfa9d",
  "asset_id": "builtin:layout:p25-spec-table",
  "dependency_hashes": {
    "canonical/layouts/p25-spec-table/layout.json": "2acd760c9fc51f5e328e3a0ec4b0a3897a4b719e301b0f189f1dea647c9aeb36",
    "canonical/layouts/p25-spec-table/notes.md": "9a3fc8ee62ed23d98d9b643ccc95d77ac64abd5e75d2176c795c48fdd6f193a2",
    "canonical/templates/spec-table/page.html": "a3605bda65935b2854b987e2369d57a36f014d5b01756120df053da0dc0104c7",
    "canonical/templates/spec-table/template.json": "eec309ab46687888bc803b008fdfa103c1feaf6d6ad4efc4358ade853052bef3"
  },
  "environment": {
    "path": "evidence/probes/expression-first-output-v6-current/environment.json",
    "sha256": "a2969d5e76143476d3380e0d7a8ba8f844cde19b472c0aa6a19f035a713967fd"
  },
  "evidence_digest": "62d81482d3a09f5462d28348ac2a77d41d1b95a4766d5ff887e3d919e9178fbd",
  "kind": "capability-evidence",
  "lane": "render:html",
  "oracle": {
    "owner": "004-U12-product-contract",
    "path": "evidence/oracles/relation-output-v1.json",
    "sha256": "6532c718cc05f95695de599e43070f36c387974019a9b8875ea9e2df0ae90c1a",
    "version": "relation-output-v1"
  },
  "probes": {
    "negative": {
      "artifact": {
        "path": "evidence/probes/expression-first-output-v6-current/comparison/negative.png",
        "sha256": "1d494407d549cad0a80d3f025ef8402f11a10f7aec61c43030e4325597c13282"
      },
      "fixture": {
        "path": "evidence/probes/expression-first-output-v6-current/comparison/negative-fixture.json",
        "sha256": "375b7f5b64cc522a6d083ebc54b7113d8ec3ba4b6d6fdfe8110ad8e3b8e65272"
      },
      "observation": {
        "path": "evidence/probes/expression-first-output-v6-current/comparison/negative-observation.json",
        "sha256": "d9a9d529d8db47edf3e865504e89db844a3f42982fef83d79643734ba0eb8abe"
      },
      "status": "passed"
    },
    "positive": {
      "artifact": {
        "path": "evidence/probes/expression-first-output-v6-current/comparison/positive.png",
        "sha256": "0e64bd232811198202652e78d99e29b49e5fdad4137d0d308125fa98ae4f5755"
      },
      "fixture": {
        "path": "evidence/probes/expression-first-output-v6-current/comparison/positive-fixture.json",
        "sha256": "b72f484dc5869c3dd856c8d5641c892d8b851336de3fbb081a9e9bc123cf97ef"
      },
      "observation": {
        "path": "evidence/probes/expression-first-output-v6-current/comparison/positive-observation.json",
        "sha256": "245a65ffebc459b8b83ea551c1d4b823f247452219862cd8c06b8989858d39a9"
      },
      "status": "passed"
    }
  },
  "receipt_id": "935a45417a5ccb0ee86625957b0e2d33f181e2464983f4a6f75e8a95b4a88dea/comparison",
  "relation": "comparison",
  "schema_version": 1,
  "visual_review": null
}
