{
  "asset_generation": "befe30d02c70f3fb8c644000829cc5aa1613c475aa8e1e5558656d8b551fdec8",
  "asset_id": "builtin:layout:body-basic",
  "dependency_hashes": {
    "canonical/layouts/body-basic/layout.json": "14639d99d75a1183aba0d344da5c9725f74a5160b79e1ba4daaba7707d30c5fe",
    "canonical/layouts/body-basic/notes.md": "ba948b2ec6ecf241a41675c9b32063fb0e7ec42098a795fc4017cfb883e32e09",
    "canonical/templates/body-basic/page.html": "572930acb275ee76ac1c0366ef959dcac7fcc5a48dd155a7c1a0b334175e3852",
    "canonical/templates/body-basic/template.json": "3feda979c71fcb66d7c99f5d92845e8bd59f591c38e242a10025355ebbff29e7"
  },
  "environment": {
    "path": "evidence/probes/expression-first-output-v4/environment.json",
    "sha256": "c080123c457e7dcbff2564e6549892b70cb3f09cd594f787788e9e0a949211bd"
  },
  "evidence_digest": "769ef0006da7b7683d1cabc73124acd41184f3e9c1825b6dc3aa915b3eb78e86",
  "kind": "capability-evidence",
  "lane": "render:html",
  "oracle": {
    "owner": "004-U12-product-contract",
    "path": "evidence/oracles/relation-output-v1.json",
    "sha256": "6532c718cc05f95695de599e43070f36c387974019a9b8875ea9e2df0ae90c1a",
    "version": "relation-output-v1"
  },
  "probes": {
    "negative": {
      "artifact": {
        "path": "evidence/probes/expression-first-output-v4/independent/negative.png",
        "sha256": "7d7caf293d8720b0d7a7d3d0a1a6a8b4df303a150a9da20808d01ed442a86bc2"
      },
      "fixture": {
        "path": "evidence/probes/expression-first-output-v4/independent/negative-fixture.json",
        "sha256": "43523ff8c8a8725b2e4a0e165d21975a50181ed54cab191bad11e7c7d510e159"
      },
      "observation": {
        "path": "evidence/probes/expression-first-output-v4/independent/negative-observation.json",
        "sha256": "9b6462fbcc45984be0af3a20b4385e037ffef5948b7f717babe9990c74015b5f"
      },
      "status": "passed"
    },
    "positive": {
      "artifact": {
        "path": "evidence/probes/expression-first-output-v4/independent/positive.png",
        "sha256": "f1b43f8a25ab135102269c44c6147aa13ddacda85cb0f8a799e01e125721bb4d"
      },
      "fixture": {
        "path": "evidence/probes/expression-first-output-v4/independent/positive-fixture.json",
        "sha256": "6cbb05c889599e5f2eb3a38251d589a50a29f8db816992107deffe05d35d4b52"
      },
      "observation": {
        "path": "evidence/probes/expression-first-output-v4/independent/positive-observation.json",
        "sha256": "32d16eba4c48cac47814cb5bc9c401062c1877489e1cd9ef44ea0630f4e555c4"
      },
      "status": "passed"
    }
  },
  "receipt_id": "2c348e11b1fd085a0dd635d79dc85a87a408bfb0632e04c411a1ff3184083fb0/independent",
  "relation": "independent",
  "schema_version": 1,
  "visual_review": null
}
